{
  "schema_version": "educational-design-request/v1",
  "request_id": "request-v0-1-fixture",
  "raw_question": "How might choices support ecological reflection?",
  "educational_intent": [],
  "target_audience": {
    "status": "not_stated",
    "description": ""
  },
  "application_setting": {
    "status": "not_stated",
    "description": ""
  },
  "preferred_interactions": [],
  "constraints": [],
  "requested_direction_count": 1
}
